Radiant Health Yoga Teacher Training Program,"Bend, OR, USA  map"
Eugene Yoga,"3575 Donald Street Eugene, OR, United States  map"
DAYA Foundation,"Portland, OR 97239, USA  map"
School Yoga Institute Ashland Oregon,"585 Weller Lane Ashland, OR, USA  map"
"The Movement Center, Inc.","Portland, OR 97232, USA  map"
CorePower Yoga (Northwest Portland),"2277 Northwest Quimby Street Portland, OR 97210, USA  map"
CorePower Yoga (Bridgeport Village),"7497 Southwest Bridgeport Road Portland, OR, United States  map"
CorePower Yoga (Southeast Portland),"844 Southeast Morrison Street Portland, OR, United States  map"
The Lotus Seed,"Portland, OR 97212, United States  map"
Asmi Yoga,"Bend, OR, USA  map"
Ananda Yoga of Portland,"4855 Southwest Watson Avenue Beaverton, OR, USA  map"
"Purna Yoga College, Cannon Beach","251 North Hemlock Street Cannon Beach, OR, United States  map"
Central Oregon Community College,"Bend, OR, USA  map"
Yoga Indigo Teacher Trainings,"924 Northwest Brooks Street #102 Bend, OR, USA  map"
The Bhaktishop,"2500 Southeast 26th Avenue Portland, OR 97202, USA  map"
Turtles Yoga & Wellness Center,"Beaverton, OR 97005, USA  map"
Rasa Center for Yoga and Wellness,"Medford, OR, USA  map"
Namaspa Yoga School,"Bend, OR, USA  map"
The Yoga Space (Portland),"2857 Southeast Stark Street Portland, OR, USA  map"
The Yoga Space (Portland),"210 NW 17th Ave Portland, OR, United States  map"
One Song Yoga,"Portland, OR, USA  map"
Yoga Union CWC,"2305 Southeast 50th Avenue Portland, OR, USA  map"
Hot Warrior Yoga,"2734 Shadowview Eugene, OR, United States  map"
Hot Yoga For Life,"714 North Fremont Street Portland, OR, USA  map"
Live Well Yoga Teacher Training,"971 Northwest Spruce Avenue #101 Corvallis, OR, USA  map"
Yoga Calm,"10040 Southwest 25th Avenue Portland, OR, USA  map"
Yoga Bhoga,"Portland, OR, USA  map"
Ulla Lundgren,"550 Southwest Industrial Way Bend, OR, United States  map"
Jaya Yoga Teacher Training,"118 3rd Street Hood River, OR, USA  map"
Om Sweet Om Yoga,"108 South Market Street Talent, OR, USA  map"
Yoga Heaven,"3304 Southwest Stonebrook Drive Portland, OR, USA  map"
YoYoYogi,"1306 Northwest Hoyt Street #101 Portland, OR, USA  map"
Deva Daaru School of Yoga & Integral Studies,"Vernonia, OR, USA  map"
Everyday People Yoga,"352 West 12th Avenue Eugene, OR, USA  map"
Love Yoga Studio,"630 Northwest Hickory Street Albany, OR, USA  map"
Erin Bowman Yoga School,"424 Northeast 4th Street McMinnville, OR, USA  map"
Svadharma School of Yoga,"1658 North Coast Highway Newport, OR, USA  map"
Practice and Presence- The Art of Teaching,"1906 Southeast 16th Avenue Portland, OR, USA  map"
Life.Love.Yoga.,"Deschutes National Forest, 164 North Elm Street Sisters, OR, USA  map"
The Yoga Lab,"550 Southwest Industrial Way Bend, OR, USA  map"
Greenwood Yoga LLC,"1008 Linda Avenue Ashland, OR, United States  map"
200 Hour Initial Yoga Teacher Certification with Dina Lang,"Portland, OR, USA  map"
Lundberg Yoga Teacher Training 200 hr,"3903 SW Kelly Ave Portland, OR, United States  map"
Sellwood Yoga,"7970 Southeast 13th Avenue Portland, OR, USA  map"
Sarasvati Institute of Ayurvedic Yoga,"3430 Southeast Belmont Street Portland, OR, USA  map"
Elevate Yoga Trainings by Jill Knouse Yoga,"2924 Northeast Schuyler Street Portland, OR, United States  map"
Twist Yoga,"3970 Mercantile Drive Lake Oswego, OR, United States  map"
Love Hive Yoga,"1847 East Burnside Street Portland, OR, United States  map"
Epidavros Yoga School,"223 East Powell Boulevard Gresham, OR, USA  map"
One Yoga Life,"Farewell Bend State Recreation Area Huntington, Oregon, United States  map"
Namaspa Yoga Community,"1135 Northwest Galveston Avenue Bend, OR, United States  map"
Love Everyone Yoga School,"4475 Northwest Westview Place #5 Corvallis, Oregon, United States  map"
Two Birds Yoga Training,"1669 Willamette Street Eugene, OR, United States  map"
Indigo Yoga Studio,"320 Liberty Street Southeast Salem, OR, United States  map"
Wyse Yoga,"300 Pennington Creek Rd Williams, Oregon, United States  map"
Sweaty Ganesh Yoga,"820 Charnelton St Eugene, OR, United States  map"
Center for Ayurveda and Yoga Study,"5001 Southeast Brooklyn Street Portland, OR, United States  map"
The Yoga Conservatory at Yoga Refuge,"7831 Southeast Stark Street Portland, OR, United States  map"
Ashland Yoga Center,"485 A Street Ashland, OR, United States  map"
Thrive Yoga School,"502 7th Street Oregon City, OR, United States  map"
Willamette Valley Power Yoga,"208 SW 5th Ave Albany, OR, United States  map"
Pure Yoga Teacher Training,"102 E 2nd St The Dalles, OR, United States  map"
Pure Yoga Teacher Training,"202 Cascade Avenue Hood River, OR, United States  map"
Firelight Yoga,"1475 N Killingsworth St Portland, OR, United States  map"
Yoga OMazing,"1849 Northwest 188th Avenue Hillsboro, OR, United States  map"
Soul Shine School of Yoga,"700 East Main Street Medford, OR, United States  map"
Ambuja Yoga Teacher Trainings,"2097 Northwest Deschutes Place Bend, OR, United States  map"
